{
  "boundaries": [],
  "cards": [
    {
      "dot": "cyan",
      "items": [
        "Click Storefront, API Service, or Database: each opens its detail view in a new tab"
      ],
      "title": "How to present"
    }
  ],
  "components": [
    {
      "id": "shopper",
      "label": "Shopper",
      "pos": [
        40,
        80
      ],
      "size": [
        120,
        60
      ],
      "sublabel": "Browser",
      "type": "external",
      "icon": "device-mobile"
    },
    {
      "id": "storefront",
      "label": "Storefront",
      "pos": [
        260,
        80
      ],
      "size": [
        150,
        64
      ],
      "sublabel": "Web UI",
      "type": "actor",
      "icon": "storefront"
    },
    {
      "id": "api",
      "label": "API Service",
      "pos": [
        510,
        80
      ],
      "size": [
        150,
        64
      ],
      "sublabel": ":8000",
      "type": "action",
      "icon": "terminal"
    },
    {
      "id": "db",
      "label": "Database",
      "pos": [
        760,
        80
      ],
      "size": [
        150,
        64
      ],
      "sublabel": "Orders + stock",
      "type": "document",
      "icon": "database"
    },
    {
      "id": "pay",
      "label": "Pay Provider",
      "pos": [
        510,
        250
      ],
      "size": [
        150,
        60
      ],
      "sublabel": "External",
      "type": "external",
      "icon": "bank"
    }
  ],
  "connections": [
    {
      "from": "shopper",
      "id": "c1",
      "to": "storefront"
    },
    {
      "from": "storefront",
      "id": "c2",
      "label": "REST",
      "to": "api"
    },
    {
      "from": "api",
      "id": "c3",
      "label": "SQL",
      "to": "db"
    },
    {
      "from": "api",
      "fromSide": "bottom",
      "id": "c4",
      "label": "charge",
      "labelAt": [
        585,
        172
      ],
      "to": "pay",
      "toSide": "top"
    }
  ],
  "diagram_type": "architecture",
  "meta": {
    "output": "shop-overview.html",
    "title": "Shop Platform (overview)",
    "animation": "trace"
  },
  "schema_version": 1
}
