{
  "boundaries": [],
  "cards": [
    {
      "dot": "emerald",
      "items": [
        "Pages call the API Service (see overview)"
      ],
      "title": "Detail"
    }
  ],
  "components": [
    {
      "id": "pages",
      "label": "Pages",
      "pos": [
        40,
        250
      ],
      "size": [
        140,
        60
      ],
      "sublabel": "Catalog, cart",
      "type": "actor",
      "icon": "browser"
    },
    {
      "id": "checkout",
      "label": "Checkout",
      "pos": [
        280,
        250
      ],
      "size": [
        140,
        60
      ],
      "sublabel": "Form + pay button",
      "type": "action",
      "icon": "shopping-cart"
    },
    {
      "id": "cdn",
      "label": "CDN",
      "pos": [
        520,
        250
      ],
      "size": [
        140,
        60
      ],
      "sublabel": "Images",
      "type": "milestone",
      "icon": "cloud"
    }
  ],
  "connections": [
    {
      "from": "pages",
      "id": "d1",
      "to": "checkout"
    },
    {
      "from": "cdn",
      "id": "d2",
      "label": "assets",
      "labelAt": [
        490,
        222
      ],
      "to": "pages"
    }
  ],
  "diagram_type": "architecture",
  "meta": {
    "output": "shop-frontend.html",
    "title": "Storefront (detail)"
  },
  "schema_version": 1
}
