{
  "schema_version": 1,
  "diagram_type": "architecture",
  "meta": {
    "title": "Checkout Platform — Baseline",
    "output": "checkout-platform.base.html",
    "visual_preset": "signal-flow"
  },
  "components": [
    { "id": "buyers", "type": "external", "label": "Buyers", "sublabel": "Web + mobile", "pos": [40, 250], "size": [120, 60] },
    { "id": "edge", "type": "milestone", "label": "Edge Gateway", "sublabel": "TLS + routing", "pos": [220, 250], "size": [130, 60] },
    { "id": "checkout", "type": "action", "label": "Checkout API", "sublabel": "v1 service", "pos": [430, 250], "size": [130, 60] },
    { "id": "cache", "type": "document", "label": "Session Cache", "sublabel": "Redis", "pos": [430, 100], "size": [130, 60] },
    { "id": "orders", "type": "document", "label": "Orders", "sublabel": "PostgreSQL", "pos": [640, 250], "size": [130, 60] },
    { "id": "queue", "type": "record", "label": "Order Events", "sublabel": "durable queue", "pos": [430, 400], "size": [130, 60] },
    { "id": "worker", "type": "action", "label": "Fulfilment", "sublabel": "async worker", "pos": [640, 400], "size": [130, 60] },
    { "id": "payments", "type": "external", "label": "Payment Rail", "sublabel": "external", "pos": [850, 250], "size": [130, 60] }
  ],
  "boundaries": [
    { "kind": "region", "label": "Production region", "wraps": ["edge", "checkout", "cache", "orders", "queue", "worker"] },
    { "kind": "scope", "label": "Checkout trust zone", "wraps": ["checkout", "orders"] }
  ],
  "connections": [
    { "id": "buyer-request", "from": "buyers", "to": "edge", "label": "HTTPS", "variant": "emphasis" },
    { "id": "edge-checkout", "from": "edge", "to": "checkout" },
    { "id": "session-read", "from": "checkout", "to": "cache", "label": "session", "fromSide": "top", "toSide": "bottom", "labelDy": -66 },
    { "id": "persist-order", "from": "checkout", "to": "orders", "label": "SQL" },
    { "id": "publish-order", "from": "checkout", "to": "queue", "label": "accepted", "variant": "dashed", "fromSide": "bottom", "toSide": "top", "labelDy": 66 },
    { "id": "consume-order", "from": "queue", "to": "worker" },
    { "id": "authorize-payment", "from": "orders", "to": "payments", "label": "authorize", "variant": "alert" }
  ]
}
